{
  "$schema": "https://json-schema.org/draft/2020-12/schema",
  "$id": "https://work-harvest.local/schemas/work-item.schema.json",
  "title": "Work Harvest Work Item",
  "description": "세션과 날짜를 넘어 유지되는 기능 또는 보고 가능한 업무 단위",
  "type": "object",
  "additionalProperties": false,
  "required": [
    "schema_version",
    "id",
    "project_id",
    "title",
    "status",
    "objective",
    "desired_outcomes",
    "classification",
    "repositories",
    "links",
    "context_path",
    "created_at",
    "updated_at",
    "completed_at"
  ],
  "properties": {
    "schema_version": {
      "enum": ["1.0", "1.1"]
    },
    "id": {
      "$ref": "./common.schema.json#/$defs/identifier"
    },
    "project_id": {
      "$ref": "./common.schema.json#/$defs/identifier"
    },
    "title": {
      "type": "string",
      "minLength": 1,
      "maxLength": 160
    },
    "status": {
      "type": "string",
      "enum": ["planned", "in_progress", "blocked", "completed", "cancelled"]
    },
    "objective": {
      "$ref": "./common.schema.json#/$defs/nonEmptyString"
    },
    "problem": {
      "description": "보고와 인수인계에 필요한 문제 배경. 외부 원문 전체를 복제하지 않는다.",
      "type": "object",
      "additionalProperties": false,
      "required": ["statement", "expected_behavior", "actual_behavior", "affected_surfaces", "source_refs"],
      "properties": {
        "statement": { "$ref": "./common.schema.json#/$defs/nonEmptyString" },
        "expected_behavior": { "type": ["string", "null"] },
        "actual_behavior": { "type": ["string", "null"] },
        "affected_surfaces": {
          "type": "array",
          "uniqueItems": true,
          "items": { "$ref": "./common.schema.json#/$defs/nonEmptyString" }
        },
        "source_refs": {
          "type": "array",
          "uniqueItems": true,
          "items": { "$ref": "./common.schema.json#/$defs/nonEmptyString" }
        }
      }
    },
    "desired_outcomes": {
      "type": "array",
      "items": {
        "$ref": "./common.schema.json#/$defs/nonEmptyString"
      }
    },
    "classification": {
      "type": "object",
      "additionalProperties": false,
      "required": ["initiative_id", "work_types", "tags"],
      "properties": {
        "initiative_id": {
          "oneOf": [
            {
              "$ref": "./common.schema.json#/$defs/identifier"
            },
            {
              "type": "null"
            }
          ]
        },
        "work_types": {
          "type": "array",
          "uniqueItems": true,
          "items": {
            "type": "string",
            "enum": [
              "planning",
              "design",
              "implementation",
              "bugfix",
              "refactoring",
              "testing",
              "documentation",
              "operation",
              "communication",
              "research",
              "other"
            ]
          }
        },
        "tags": {
          "type": "array",
          "uniqueItems": true,
          "items": {
            "type": "string",
            "minLength": 1,
            "maxLength": 64
          }
        }
      }
    },
    "scope": {
      "description": "업무가 속한 기본 범위. 기존 기록은 unclassified로 해석한다.",
      "type": "string",
      "enum": ["company", "personal", "unclassified"]
    },
    "reporting": {
      "description": "주간 보고서에서 이 업무를 다루는 방식",
      "type": "object",
      "additionalProperties": false,
      "required": ["mode", "exclusion_reason"],
      "properties": {
        "mode": {
          "type": "string",
          "enum": ["primary", "supporting", "excluded"]
        },
        "exclusion_reason": {
          "oneOf": [
            {
              "type": "string",
              "minLength": 1,
              "maxLength": 240
            },
            {
              "type": "null"
            }
          ]
        }
      }
    },
    "repositories": {
      "type": "array",
      "items": {
        "$ref": "./common.schema.json#/$defs/repository"
      }
    },
    "links": {
      "type": "array",
      "items": {
        "$ref": "./common.schema.json#/$defs/externalLink"
      }
    },
    "external_refs": {
      "type": "array",
      "items": { "$ref": "./common.schema.json#/$defs/externalReference" }
    },
    "completion": {
      "description": "업무 전체가 목표로 하는 완료 게이트와 현재 도달 상태",
      "type": "object",
      "additionalProperties": false,
      "required": ["target_gate", "current_gate", "remaining_gates"],
      "properties": {
        "target_gate": { "type": "string", "enum": ["development", "review", "qa", "release", "operational"] },
        "current_gate": { "type": ["string", "null"] },
        "remaining_gates": {
          "type": "array",
          "uniqueItems": true,
          "items": { "type": "string", "enum": ["development", "review", "qa", "release", "operational"] }
        }
      }
    },
    "context_path": {
      "type": "string",
      "pattern": "^work-items/.+/context\\.md$"
    },
    "created_at": {
      "$ref": "./common.schema.json#/$defs/timestamp"
    },
    "updated_at": {
      "$ref": "./common.schema.json#/$defs/timestamp"
    },
    "completed_at": {
      "oneOf": [
        {
          "$ref": "./common.schema.json#/$defs/timestamp"
        },
        {
          "type": "null"
        }
      ]
    }
  },
  "allOf": [
    {
      "if": {
        "properties": {
          "status": {
            "const": "completed"
          }
        }
      },
      "then": {
        "properties": {
          "completed_at": {
            "$ref": "./common.schema.json#/$defs/timestamp"
          }
        }
      },
      "else": {
        "properties": {
          "completed_at": {
            "type": "null"
          }
        }
      }
    }
  ]
}
